{
  "apiVersion": "loop-engineering/v1",
  "loop": "example-loop",
  "experimentId": "strategy-v2-benchmark",
  "experimentSha256": "0000000000000000000000000000000000000000000000000000000000000000",
  "baselineVersion": 1,
  "approver": "human-operator",
  "approvedAt": "2026-07-11T00:00:00Z",
  "reason": "Matched benchmark evidence exceeds the promotion threshold without weakening safety."
}
